"","pert","cell","type","trend","WTCS","WTCS_Pval","WTCS_FDR","NCS","Tau","TauRefSize","NCSct","N_upset","N_downset","t_gn_sym","MOAss","PCIDss","MOA","Target","Disease.Area","Indication","Phase","fda_approval"
"1","etoposide","HA1E","trt_cp","down",-0.713393073578185,1.24898009025644e-05,0.000124761495428982,-2.02685618811518,-99.553770638108,2241,-1.78371547857225,100,31,"ABCB1; ABCC1; ABCC2; ABCC3; ABCG2; APAF1; BAX; CASP2; CASP6; CASP8; CASP9; CDKN1A; CYCS; CYP2E1; CYP3A5; DCK; FAS; H2AFX; KMT2A; LMNB1; MAPK8; MCL1; RB1; TOP2A; TOP2B; TP53","Topoisomerase inhibitor",73707602,"topoisomerase inhibitor","TOP2A, TOP2B","oncology","non-small cell lung cancer (NSCLC)","Launched",TRUE
"2","chlorambucil","HA1E","trt_cp","down",-0.56316463239117,1.90175714091311e-05,0.000124761495428982,-1.60003476675829,-98.88442659527,2241,-0.926056371294621,100,31,NA,"DNA inhibitor",2708,"DNA inhibitor","","hematologic malignancy","chronic lymphocytic leukemia (CLL), Hodgkin's lymphoma","Launched",TRUE
"3","methylene-blue","HA1E","trt_cp","down",-0.545071270612658,1.98009038699191e-05,0.000124761495428982,-1.54862882571005,-96.9656403391343,2241,-1.3727844991117,100,31,"ACHE; MAPT","Guanylyl cyclase inhibitor; Monoamine oxidase inhibitor; Nitric oxide production inhibitor; Tau aggregation inhibitor",4139,"guanylyl cyclase inhibitor, nitric oxide production inhibitor","ACHE","hematology","methemoglobinemia","Launched",TRUE
"4","vorinostat","NKDBA","trt_cp","down",-0.531516565777251,2.03666439804882e-05,0.000124761495428982,-1.28376791854094,NA,229,-1.07130097458377,100,31,"HDAC1; HDAC10; HDAC11; HDAC2; HDAC3; HDAC4; HDAC5; HDAC6; HDAC7; HDAC8; HDAC9","HDAC inhibitor",5311,"HDAC inhibitor","HDAC1, HDAC10, HDAC11, HDAC2, HDAC3, HDAC5, HDAC6, HDAC8, HDAC9","hematologic malignancy","cutaneous T-cell lymphoma (CTCL)","Launched",TRUE
"5","ixazomib","NKDBA","trt_cp","down",-0.524699426402266,2.06712732707947e-05,0.000124761495428982,-1.26730253366055,NA,229,-1.34440273544,100,31,"PSMB5",NA,25183872,"proteasome inhibitor","","hematologic malignancy","multiple myeloma","Launched",TRUE
"6","irinotecan","HA1E","trt_cp","down",-0.524375875343056,2.07147917408385e-05,0.000124761495428982,-1.48983011918871,-98.2150825524319,2241,-1.28946873266612,100,31,"ABCB1; ABCC2; ABCG2; CES2; CES5A; CYP3A5; TOP1; TOP1MT","Topoisomerase inhibitor",60838,"topoisomerase inhibitor","TOP1, TOP1MT","oncology","colorectal cancer","Launched",TRUE
"7","tigecycline","HA1E","trt_cp","down",-0.518824695915572,2.09323840910573e-05,0.000124761495428982,-1.47405838998268,-97.7688531905399,2241,-1.51769040782156,100,31,NA,NA,73707446,"bacterial 30S ribosomal subunit inhibitor","","infectious disease","skin infections, pneumonia, intra-abdominal infections","Launched",TRUE
"8","dactinomycin","HA1E","trt_cp","down",-0.494981570668902,2.1976827372108e-05,0.000124761495428982,-1.40631651283236,-93.1726907630522,2241,-1.07428078814296,100,31,"POLR2A; TOP2A; TOP2B","RNA polymerase inhibitor",457193,"RNA polymerase inhibitor","POLR2A","oncology","testicular carcinoma, Wilm's tumor, rhabdomyosarcoma, Ewing's sarcoma, gestational trophoblastic disease (GTD)","Launched",TRUE
"9","mitoxantrone","HA1E","trt_cp","down",-0.479065911753597,2.26731228928085e-05,0.000124761495428982,-1.36109775061672,-92.681838464971,2241,-1.14597370619101,100,31,"ABCB1; ABCC1; ABCG2; PIM1; TOP2A; TOP2B","Topoisomerase inhibitor",4212,"topoisomerase inhibitor","TOP2A","neurology/psychiatry, oncology, hematologic malignancy","multiple sclerosis, prostate cancer, acute myeloid leukemia (AML)","Launched",TRUE
"10","doxorubicin","HA1E","trt_cp","down",-0.472910845572206,2.29342337130712e-05,0.000124761495428982,-1.34361028901938,-96.9210174029451,2241,-1.16922698146546,100,31,"CHD1; NOLC1; TOP2A","Topoisomerase inhibitor",31703,"topoisomerase inhibitor","TOP2A","hematologic malignancy, oncology","acute lymphoblastic leukemia (ALL), acute myeloid leukemia (AML), Wilm's tumor, breast cancer, ovarian cancer, Hodgkin's lymphoma, bladder cancer, multiple myeloma","Launched",TRUE
"11","daunorubicin","HA1E","trt_cp","down",-0.46303576892115,2.33694184135089e-05,0.000124761495428982,-1.31555372250702,-87.9071842927265,2241,-1.07273545505775,100,31,"ABCB1; ABCG2; DCXR; TOP2A; TOP2B","RNA synthesis inhibitor; Topoisomerase inhibitor",2958,"RNA synthesis inhibitor, topoisomerase inhibitor","TOP2A, TOP2B","hematologic malignancy","acute myeloid leukemia (AML), acute lymphoblastic leukemia (ALL)","Launched",TRUE
"12","sulconazole","HA1E","trt_cp","down",-0.437281977434643,2.45008986346472e-05,0.000124761495428982,-1.24238335742338,-92.7710843373494,2241,-1.2481983410301,100,31,NA,"Sterol demethylase inhibitor",65495,"sterol demethylase inhibitor","","infectious disease","tinea pedis, tinea cruris, tinea corporis","Launched",TRUE
"13","vincristine","HA1E","trt_cp","down",-0.430897326316316,2.47620094549098e-05,0.000124761495428982,-1.22424361075717,-73.8955823293173,2241,0,100,31,"TUBA4A; TUBB","Tubulin inhibitor",6324671,"tubulin polymerization inhibitor","TUBA4A, TUBB","hematologic malignancy","acute lymphoblastic leukemia (ALL)","Launched",TRUE
"14","actinomycin-d","HA1E","trt_cp","down",-0.419429321395298,2.52842310954352e-05,0.000124761495428982,-1.1916612973028,-91.2092815707273,2241,-1.1916612973028,100,31,NA,NA,2019,"RNA polymerase inhibitor","","oncology","Wilm's tumor, Ewing's sarcoma, rhabdomyosarcoma, testicular carcinoma","Launched",TRUE
"15","pimozide","HA1E","trt_cp","down",-0.409632865768394,2.56758973258292e-05,0.000124761495428982,-1.16382810485338,-78.1347612672914,2241,-1.10705510039468,100,31,"CACNA1I; CALM1; CALM2; CALM3; DRD3; HRH1; KCNA10; KCNH2","Dopamine receptor antagonist",16362,"dopamine receptor antagonist","CACNA1I, CALM1, DRD1, DRD2, DRD3, DRD4, DRD5, HRH1, HTR1A, HTR2A, KCNA10, KCNH2","neurology/psychiatry","Tourette's disorder","Launched",TRUE
"16","clomipramine","HA1E","trt_cp","down",-0.406902821862432,2.58064527359605e-05,0.000124761495428982,-1.15607164268748,-82.5078090138331,2241,-0.0264678876528265,100,31,"HTR2B; SLC6A2; SLC6A3; SLC6A4","Serotonin transporter inhibitor (SERT)",2801,"serotonin transporter (SERT) inhibitor","GSTP1, HTR2A, HTR2B, HTR2C, SLC6A2, SLC6A3, SLC6A4","neurology/psychiatry","obsessive compulsive disorder (OCD)","Launched",TRUE
"17","bromocriptine","HA1E","trt_cp","down",-0.406471015742993,2.58499712060043e-05,0.000124761495428982,-1.15484481705983,-70.504239178938,2241,-0.879117709980823,100,31,"ADCY10; ADRA1A; ADRA1B; ADRA1D; ADRA2B; ADRA2C; DRD1; DRD3; DRD4; GH1; HTR1B; HTR1D; HTR2B; HTR6; HTR7; PRL; PRLR","Dopamine receptor agonist",31101,"dopamine receptor agonist","ADRA1A, ADRA1B, ADRA1D, ADRA2A, ADRA2B, ADRA2C, DRD1, DRD2, DRD3, DRD4, DRD5, HTR1A, HTR1B, HTR1D, HTR2A, HTR2B, HTR2C, HTR6, HTR7","endocrinology, neurology/psychiatry","hyperprolactinemia, Parkinson's Disease, acromegaly","Launched",TRUE
"18","crizotinib","HA1E","trt_cp","down",-0.405327032526509,2.58934896760481e-05,0.000124761495428982,-1.15159459001487,-73.2708612226684,2241,-1.07832970541273,100,31,"ALK; AXL; CYP2B6; CYP3A5; EPHA2; EPHA6; EPHB6; IRAK1; IRAK3; LTK; MAP3K2; MAP4K1; MAP4K2; MAP4K3; MAP4K5; MERTK; MET; MST1R; NTRK2; NTRK3; NUDT1; PLK4; ROS1; SLK; STK10; TEK; TIE1","ALK inhibitor",11626560,"ALK tyrosine kinase receptor inhibitor","ALK, MET","oncology","non-small cell lung cancer (NSCLC)","Launched",TRUE
"19","methotrexate","HA1E","trt_cp","down",-0.402716636264975,2.59805266161356e-05,0.000124761495428982,-1.14417806466288,-82.1062025881303,2241,-1.18633122409627,100,31,"ABCB1; ABCC2; ABCC3; ABCC4; ABCG2; AOX1; CRP; DHFR; FOLR1; FOLR2; FPGS; GGH; PDF; SLC19A1; SLC22A6; TYMS","Dihydrofolate reductase inhibitor",4112,"dihydrofolate reductase inhibitor","DHFR","oncology, hematologic malignancy, dermatology, rheumatology","gestational choriocarcinoma, hydatidiform mole, acute lymphoblastic leukemia (ALL), psoriasis, rheumatoid arthritis","Launched",TRUE
"20","carvedilol","HA1E","trt_cp","down",-0.402189020611064,2.60240450861794e-05,0.000124761495428982,-1.14267902984928,-81.8830879071843,2241,-0.731980326646368,100,31,"ADRA1A; ADRA1B; ADRA1D; ADRA2B; ADRA2C; ADRB1; ADRB2; ADRB3; CYP2E1; GJA1; HIF1A; KCNH2; KCNJ4; NDUFC2; NPPB; RYR2; SELE; VCAM1; VEGFA","Adrenergic receptor antagonist",2585,"adrenergic receptor antagonist","ADRB1, ADRB2, ADRB3","cardiology","myocardial infarction, hypertension","Launched",TRUE
"21","ivermectin","HA1E","trt_cp","down",-0.401963908769046,2.60240450861794e-05,0.000124761495428982,-1.14203945351064,-77.4654172244534,2241,-1.33949012695691,100,31,"CHRNA7; GABRB3; GLRA3; P2RX7","GABA receptor agonist",45114068,"benzodiazepine receptor agonist","CHRNA7, P2RX7","infectious disease","gastrointestinal roundworms, lungworms, cattle grubs, mites, lice, horn flies","Launched",TRUE
"22","promazine","HA1E","trt_cp","down",-0.39790608259505,2.61981189663545e-05,0.000124761495428982,-1.13051056376434,-80.7228915662651,2241,-1.05429336377136,100,31,"ADRA1A; ADRA1B; ADRA1D; CHRM1; CHRM4; CHRM5; DRD1; DRD3; DRD4; HRH1; PRNP","Dopamine receptor antagonist",4926,"dopamine receptor antagonist","ADRA1A, ADRA1B, ADRA1D, CHRM1, CHRM2, CHRM3, CHRM4, CHRM5, DRD1, DRD2, DRD3, DRD4, HRH1, HTR2A, HTR2C","neurology/psychiatry","schizophrenia","Launched",TRUE
"23","vinblastine","HA1E","trt_cp","down",-0.394801310789516,2.63286743764859e-05,0.000124761495428982,-1.12168944371173,-64.524765729585,2241,-0.936649886633674,100,31,"ABCB1; ABCB4; ABCC2; JUN; STMN4; TUBA1A; TUBB; TUBD1; TUBE1; TUBG1","Microtubule inhibitor; Tubulin inhibitor",5667,"microtubule inhibitor, tubulin polymerization inhibitor","JUN, TUBA1A, TUBB, TUBD1, TUBE1, TUBG1","hematologic malignancy, infectious disease, oncology","Hodgkin's lymphoma, true histiocytic lymphoma (THL), mycosis, small lymphocytic lymphoma (SLL), testicular carcinoma, Kaposi sarcoma","Launched",TRUE
"24","thiothixene","HA1E","trt_cp","down",-0.394462751636959,2.63721928465296e-05,0.000124761495428982,-1.12072754663308,-73.4493529674253,2241,-0.024810038862175,100,31,"DRD1; HRH1","Dopamine receptor antagonist",6444849,"dopamine receptor antagonist","DRD1, DRD2, HRH1, HTR2A","neurology/psychiatry","schizophrenia","Launched",TRUE
"25","nortriptyline","HA1E","trt_cp","down",-0.393552816858585,2.63721928465296e-05,0.000124761495428982,-1.11814228612995,-69.9687639446676,2241,-1.13910081125112,100,31,"ADRA1A; ADRA1B; ADRA1D; ADRA2B; ADRA2C; ADRB1; ADRB2; ADRB3; CHRM1; CHRM4; CHRM5; HRH1; HTR6; KCNJ10; PGRMC1; PIK3CD; SIGMAR1; SLC6A2; SLC6A4","Tricyclic antidepressant",441358,"tricyclic antidepressant","ADRA1A, ADRA1B, ADRA1D, ADRA2A, ADRA2B, ADRA2C, ADRB1, ADRB2, ADRB3, CHRM1, CHRM2, CHRM3, CHRM4, CHRM5, DRD2, HRH1, HTR1A, HTR2A, HTR2C, HTR6, KCNJ10, PGRMC1, SIGMAR1, SLC6A2, SLC6A4","neurology/psychiatry","depression","Launched",TRUE
"26","nilotinib","HA1E","trt_cp","down",-0.385703151789743,2.67203406068799e-05,0.000124761495428982,-1.09584021619309,-81.8384649709951,2241,-0.929358191680404,100,31,"ABL1; ABL2; BCR; CYP2B6; CYP2C8; DDR1; DDR2; EPHA2; EPHA4; EPHA5; EPHA8; EPHB1; EPHB2; EPHB3; EPHB4; KIT; MAPK11; MLTK; PDGFRA","ABL inhibitor; BCR-ABL kinase inhibitor",644241,"Abl kinase inhibitor, Bcr-Abl kinase inhibitor","ABL1, KIT","hematologic malignancy","chronic myeloid leukemia (CML)","Launched",TRUE
"27","amisulpride","HA1E","trt_cp","down",-0.38501915847014,2.67638590769236e-05,0.000124761495428982,-1.09389688909361,-86.5238732708612,2241,-0.0205406126610204,100,31,"DRD3; HTR7","Dopamine receptor antagonist",2159,"dopamine receptor antagonist","DRD2","neurology/psychiatry","psychosis, bipolar disorder, schizophrenia","Launched",TRUE
"28","tacrolimus","HA1E","trt_cp","down",-0.381424002782238,2.69379329570988e-05,0.000124761495428982,-1.08368251524678,-70.8165997322624,2241,-0.984662635664734,100,31,"ABCB1; ABCG2; CYP3A5; CYP3A7; FKBP1A; FKBP2; FKBP4; IFNG; IL10; IL2; IL2RA; IL4; NFATC1; NFATC2; NFATC3; PPP3CA; PPP3CB; PPP3CC; PPP3R1; PPP3R2","Calcineurin inhibitor",24140138,"calcineurin inhibitor","FKBP1A","transplant","organ rejection","Launched",TRUE
"29","simvastatin","HA1E","trt_cp","down",-0.380418269829139,2.69814514271425e-05,0.000124761495428982,-1.08082507783243,-53.9491298527443,2241,-1.31224303476999,100,31,"APOA1; APOE; COG2; CYP2C8; CYP3A4; CYP3A5; HMGCR; ITGAL; ITGB2; LDLR; PON1","HMGCR inhibitor",54454,"HMGCR inhibitor","HMGCR, ITGB2","endocrinology, cardiology, neurology/psychiatry","hypercholesterolemia, coronary heart disease, myocardial infarction, stroke, hyperlipidemia","Launched",TRUE
"30","clemastine","HA1E","trt_cp","down",-0.379852248001893,2.69814514271425e-05,0.000124761495428982,-1.07921692534869,-74.8326639892905,2241,-0.0254241708260004,100,31,"HRH1","Histamine receptor antagonist",26987,"histamine receptor antagonist","HRH1","allergy","allergic rhinitis, urticaria","Launched",TRUE
"31","imipramine","HA1E","trt_cp","down",-0.373420782777219,2.7286080717449e-05,0.000124761495428982,-1.06094417281985,-79.8750557786702,2241,-0.930152393384665,100,31,"ADRA1A; ADRA1B; ADRA1D; CHRM1; CHRM4; CHRM5; DRD1; FMO1; HRH1; HTR6; HTR7; KCND2; KCND3; KCNH1; KCNH2; ORM2; SLC22A3; SLC6A2; SLC6A3; SLC6A4","Norepinephrine reuptake inhibitor; Serotonin reuptake inhibitor",3696,"norepinephrine reputake inhibitor, serotonin reuptake inhibitor","ADRA1A, ADRA1B, ADRA1D, CHRM1, CHRM2, CHRM3, CHRM4, CHRM5, DRD1, DRD2, DRD5, HRH1, HTR1A, HTR2A, HTR2C, HTR6, HTR7, KCND2, KCND3, KCNH1, KCNH2, SLC6A2, SLC6A3, SLC6A4","neurology/psychiatry, urology","depression, nocturnal enuresis","Launched",TRUE
"32","pyrimethamine","HA1E","trt_cp","down",-0.373265014833102,2.7286080717449e-05,0.000124761495428982,-1.06050161284396,-76.5729585006693,2241,-1.06206418621059,100,31,"DHFR; DHFRP1; HEXA; HEXB; PDF; SLC47A1; STAT3","Dihydrofolate reductase inhibitor",4993,"dihydrofolate reductase inhibitor","DHFR, SLC47A1","infectious disease","malaria","Launched",TRUE
"33","cetirizine","HA1E","trt_cp","down",-0.370360449582675,2.74166361275803e-05,0.000124761495428982,-1.05224930949304,-64.6140116019634,2241,0.842926891767388,100,31,"HRH1; IL8","Histamine receptor antagonist",2678,"histamine receptor antagonist","HRH1","allergy","allergic rhinitis","Launched",TRUE
"34","nizatidine","HA1E","trt_cp","down",-0.369643294899907,2.74166361275803e-05,0.000124761495428982,-1.05021176601184,-59.7054886211513,2241,-0.0278586783153422,100,31,"HRH2","Histamine receptor antagonist",5353831,"histamine receptor antagonist","HRH2","gastroenterology","duodenal ulcer disease, erosive esophagitis (EE), ulcerative esophagitis (UE), gastroesophageal reflux disease (GERD)","Launched",TRUE
"35","sertraline","HA1E","trt_cp","down",-0.369618413464061,2.74166361275803e-05,0.000124761495428982,-1.05014107413932,-64.7925033467202,2241,-1.24064944547354,100,31,"CYP2C9; PGRMC1; SIGMAR1; SLC6A3; SLC6A4","Serotonin receptor antagonist",6093397,"selective serotonin reuptake inhibitor (SSRI)","SLC6A3, SLC6A4","neurology/psychiatry, obstetrics/gynecology","depression, obsessive compulsive disorder (OCD), panic disorders, posttraumatic stress disorder, premenstrual syndrome, social anxiety disorder","Launched",TRUE
"36","amitriptyline","HA1E","trt_cp","down",-0.369157323664296,2.74601545976241e-05,0.000124761495428982,-1.0488310492056,-49.6207050423918,2241,-0.918431655041583,100,31,"ADRA1A; ADRA1B; ADRA1D; ADRB1; ADRB2; ADRB3; CHRM1; CHRM4; CHRM5; CYP2C9; HRH1; HRH2; HRH4; HTR1B; HTR1D; HTR6; HTR7; KCNA1; KCND2; KCND3; KCNQ2; KCNQ3; NTRK1; NTRK2; OPRD1; OPRK1; OPRM1; ORM2; SIGMAR1; SLC6A2; SLC6A4","Norepinephrine inhibitor; Norepinephrine reuptake inhibitor; Serotonin receptor antagonist; Serotonin reuptake inhibitor",2160,"norepinephrine inhibitor, norepinephrine reuptake inhibitor, serotonin receptor antagonist, serotonin–norepinephrine reuptake inhibitor (SNRI)","ADRA1A, ADRA1B, ADRA1D, ADRA2A, ADRB1, ADRB2, ADRB3, CHRM1, CHRM2, CHRM3, CHRM4, CHRM5, HRH1, HRH2, HRH4, HTR1A, HTR1B, HTR1D, HTR2A, HTR2C, HTR6, HTR7, KCNA1, KCND2, KCND3, KCNQ2, KCNQ3, NTRK1, NTRK2, OPRD1, OPRK1, OPRM1, SIGMAR1, SLC6A2, SLC6A4","neurology/psychiatry","depression","Launched",TRUE
"37","fenbendazole","HA1E","trt_cp","down",-0.368619059144622,2.74601545976241e-05,0.000124761495428982,-1.04730175937514,-44.2213297634984,2241,0.0263327004475226,100,31,"CYP2D6; CYP2J2; CYP3A4; TUBB","Tubulin inhibitor",3334,"tubulin polymerization inhibitor","TUBB","infectious disease","gastrointestinal parasites, gastrointestinal roundworms","Launched",TRUE
"38","artesunate","HA1E","trt_cp","down",-0.365901672740515,2.75907100077554e-05,0.000124761495428982,-1.039581259061,-67.7376171352075,2241,-1.14294087521209,100,31,NA,"DNA synthesis inhibitor",73707396,"DNA synthesis inhibitor","","infectious disease","malaria","Launched",TRUE
"39","paclitaxel","HA1E","trt_cp","down",-0.364563214541065,2.76342284777992e-05,0.000124761495428982,-1.03577849956618,-54.9754573850959,2241,-1.00293973618305,100,31,"ABCB1; BCL2; CYP2C8; KIF11; KIF1A; KIF1B; KIF1C; KIF5B; MAP2; MAP4; MAPT; NDC80; NR1I2; NUF2; TLR4; TUBB; TUBB1","Tubulin inhibitor",4666,"tubulin polymerization inhibitor","BCL2, MAP2, MAP4, MAPT, NR1I2, TLR4, TUBA1A, TUBA1B, TUBA1C, TUBA3C, TUBA3D, TUBA3E, TUBA4A, TUBB, TUBB1, TUBB2A, TUBB2B, TUBB3, TUBB4A, TUBB4B, TUBB6, TUBB8","oncology","ovarian cancer, breast cancer, non-small cell lung cancer (NSCLC)","Launched",TRUE
"40","mebendazole","HA1E","trt_cp","down",-0.364415592489383,2.77212654178868e-05,0.000124761495428982,-1.03535908328638,-58.5006693440428,2241,0,100,31,"TUBA1A; TUBB; TUBB4B","Tubulin inhibitor",4030,"tubulin polymerization inhibitor","TUBA1A, TUBB, TUBB4B","infectious disease","pinworm, whipworm, hookworm, ascariasis","Launched",TRUE
"41","clofarabine","HA1E","trt_cp","down",-0.357024133167326,2.80258947081932e-05,0.000124761495428982,-1.01435884425831,-63.0075858991522,2241,-1.55838203946296,100,31,"DCK; POLA1; RRM1; RRM2; SLC22A8","Ribonucleoside reductase inhibitor",119182,"ribonucleotide reductase inhibitor","POLA1, POLD1, POLE, RRM1, RRM2, RRM2B","hematologic malignancy","acute lymphoblastic leukemia (ALL)","Launched",TRUE
"42","paroxetine","HA1E","trt_cp","down",-0.356747363951191,2.80258947081932e-05,0.000124761495428982,-1.01357250161051,-48.9067380633646,2241,-1.15756245926976,100,31,"ADRBK1; CHRM1; CHRM4; CHRM5; CYP2B6; GNG2; GNG4; GRK1; SLC6A2; SLC6A4","Selective serotonin reuptake inhibitor (SSRI)",9951025,"selective serotonin reuptake inhibitor (SSRI)","CHRM1, CHRM2, CHRM3, CHRM4, CHRM5, HTR2A, SLC6A2, SLC6A4","neurology/psychiatry","depression, obsessive compulsive disorder (OCD), generalized anxiety disorder (GAD), panic disorders, posttraumatic stress disorder, social anxiety disorder","Launched",TRUE
"43","estradiol-cypionate","HA1E","trt_cp","down",-0.354035983596647,2.83958017035653e-05,0.000124761495428982,-1.00586906537951,-74.7880410531013,2241,-0.560743376951498,100,31,"ESR1","Estrogen receptor agonist",9403,"estrogen receptor agonist","ESR1","endocrinology","hypoestrogenism, menopause","Launched",TRUE
"44","cefixime","HA1E","trt_cp","down",-0.353983718122383,2.83958017035653e-05,0.000124761495428982,-1.00572057136708,-52.7889335118251,2241,-0.621132034824374,100,31,NA,"Bacterial cell wall synthesis inhibitor",6321411,"bacterial cell wall synthesis inhibitor","","infectious disease, otolaryngology, pulmonary","urinary tract infections, otitis, pharyngitis, tonsillitis, gonorrhea, bronchitis","Launched",TRUE
"45","formoterol","HA1E","trt_cp","down",-0.349468257480614,2.9440244984616e-05,0.000124761495428982,-0.992891473800919,-47.2110664881749,2241,0.0279433544961389,100,31,"ADRB1; ADRB2; ADRB3","Adrenergic receptor agonist",23581795,"adrenergic receptor agonist","ADRB2","pulmonary","asthma, chronic obstructive pulmonary disease (COPD), bronchospasm","Launched",TRUE
"46","xylazine","HA1E","trt_cp","down",-0.347139233200211,2.99407073901195e-05,0.000124761495428982,-0.986274368239005,-81.9277108433735,2241,0.755006445683752,100,31,"ADRA2B; ADRA2C","Adrenergic receptor agonist",5707,"adrenergic receptor agonist","ADRA2A, ADRA2B, ADRA2C","neurology/psychiatry","anesthetic","Launched",TRUE
"47","fulvestrant","HA1E","trt_cp","down",-0.345040074694044,3.03976513255791e-05,0.000124761495428982,-0.980310345646636,-78.2240071396698,2241,-0.848243053602441,100,31,"CCND1; EPHX2; ESR1; ESR2; ESRRA; GPER1; RB1","Estrogen receptor antagonist",73707501,"estrogen receptor antagonist","ESR1, ESR2, GPER1","oncology","breast cancer","Launched",TRUE
"48","oxymetazoline","HA1E","trt_cp","down",-0.344647168351854,3.03976513255791e-05,0.000124761495428982,-0.979194040091518,-45.9616242748773,2241,0.0317291182418836,100,31,"ADRA1A; ADRA1B; ADRA1D; ADRA2B; ADRA2C; HTR1B; HTR1D; HTR1E; NISCH","Adrenergic receptor agonist",4636,"adrenergic receptor agonist","ADRA1A, ADRA1B, ADRA1D, ADRA2A, ADRA2B, ADRA2C, HTR1B, HTR1D, HTR2C","otolaryngology","nasal congestion","Launched",TRUE
"49","diltiazem","HA1E","trt_cp","down",-0.343575993407663,3.07457990859294e-05,0.000124951710540588,-0.976150672213979,-67.7376171352075,2241,-0.854205944036297,100,31,"CACNA1C; CACNA1S; CACNA2D1; CACNG1; CYP3A5; CYP3A7; EDN1; HTR3A; KCNA5","Calcium channel blocker",39186,"calcium channel blocker","CACNA1C, CACNA1S, CACNA2D1, CACNG1, HTR3A, KCNA5","cardiology","hypertension, angina pectoris","Launched",TRUE
"50","riluzole","HA1E","trt_cp","down",-0.338196554188184,3.52499607354604e-05,0.000134827065797654,-0.96086688256923,-47.0325747434181,2241,0,100,31,"BDNF; GDNF; KCND3; KCNK10; KCNK2; KCNK4; KCNN4; MAP2; NGF; SCN5A; SLC7A11","Glutamate inhibitor",5070,"glutamate inhibitor","KCNK10, KCNK2, KCNK4, KCNN4, SCN10A, SCN11A, SCN1A, SCN2A, SCN3A, SCN4A, SCN5A, SCN7A, SCN8A, SCN9A, SLC7A11","neurology/psychiatry","amyotrophic lateral sclerosis (ALS)","Launched",TRUE
"51","brompheniramine","HA1E","trt_cp","down",-0.333922048332135,4.07115287259546e-05,0.000149555476748998,-0.948722373509149,-71.2628290941544,2241,-1.08118363980004,100,31,"CHRM1; CHRM4; CHRM5; HRH1","Histamine receptor antagonist",6834,"histamine receptor antagonist","HRH1","allergy, otolaryngology","allergic rhinitis, common cold","Launched",TRUE
"52","digoxin","HA1E","trt_cp","down",-0.333634395274834,4.07115287259546e-05,0.000149555476748998,-0.9479051082443,-62.3828647925033,2241,-0.232855069249597,100,31,"ABCB1; ABCG2; ATP1A1; RORC; SLCO1B3; SLCO4C1","ATPase inhibitor",30322,"ATPase inhibitor","ATP1A1","cardiology","congestive heart failure, atrial fibrillation (AF)","Launched",TRUE
"53","homatropine","HA1E","trt_cp","down",-0.333026312720669,4.20388420622898e-05,0.000152831028068554,-0.946177454958274,-59.4823739402053,2241,-0.615419626400036,100,31,"CES1; CHRM1; CHRM4; CHRM5","Acetylcholine receptor antagonist",688024,"acetylcholine receptor antagonist","CHRM1","ophthalmology","uveal tract inflammation, pupil dilation","Launched",TRUE
"54","prednisone","HA1E","trt_cp","down",-0.330984432331391,4.57814304860547e-05,0.000163475634764346,-0.940376168044118,-65.5957161981258,2241,0.843124821461613,100,31,"HSD11B1; NR3C1; SERPINA6","Glucocorticoid receptor agonist",5865,"glucocorticoid receptor agonist","HSD11B1, NR3C1","endocrinology, rheumatology, infectious disease, dermatology, ophthalmology, hematology, gastroenterology, neurology/psychiatry","congenital adrenal hyperplasia, hypercalcemia, rheumatoid arthritis, psoriatic arthritis, ankylosing spondylitis, bursitis, osteoarthritis, epicondylitis, dermatomyositis, psoriasis, mycosis, conjunctivitis, anemia, ulcerative colitis, enteritis, multiple sclerosis, meningitis","Launched",TRUE
"55","norethindrone","HA1E","trt_cp","down",-0.328001671081013,5.31360519234533e-05,0.000184351532703776,-0.931901698187444,-62.8290941543954,2241,0.895426423815604,100,31,"PGR","Progesterone receptor agonist; Progestogen hormone",6230,"progesterone receptor agonist","PGR","obstetrics/gynecology","endometriosis","Launched",TRUE
"56","exemestane","HA1E","trt_cp","down",-0.326524148424463,5.60082709463426e-05,0.000192471105930616,-0.927703835816158,-60.8656849620705,2241,-0.0251373829037772,100,31,"CYP19A1","Aromatase inhibitor",60198,"aromatase inhibitor","CYP19A1","oncology","breast cancer","Launched",TRUE
"57","butoconazole","HA1E","trt_cp","down",-0.324664482778711,6.28841892132596e-05,0.000211854394801302,-0.922420248181909,-58.4114234716644,2241,-0.0264344244318217,100,31,"CYP51A1","Bacterial cell wall synthesis inhibitor",47472,"bacterial cell wall synthesis inhibitor","","infectious disease","vulvovaginal candidiasis","Launched",TRUE
"58","perphenazine","HA1E","trt_cp","down",-0.323071290406244,7.19577902173874e-05,0.00023826588423015,-0.91789375088527,-51.7179830432842,2241,-1.35059137650162,100,31,"AOX1; CALM1; CALM2; CALM3; DRD1; HRH1; HTR6; HTR7","Dopamine receptor antagonist",4748,"dopamine receptor antagonist","CALM1, DRD1, DRD2, HRH1, HTR2A, HTR2C, HTR6, HTR7","neurology/psychiatry, gastroenterology","schizophrenia, nausea, vomiting","Launched",TRUE
"59","amiloride","HA1E","trt_cp","down",-0.322606825513375,7.19577902173874e-05,0.00023826588423015,-0.916574136808347,-46.4078536367693,2241,0.845368570376083,100,31,"ADCY10; AOC1; ASIC1; ASIC2; ASIC3; ASIC4; PKD2; PKD2L1; PLAT; PLAU; SCNN1A; SCNN1B; SCNN1D; SCNN1G; SLC9A1; SLC9A2; SLC9A3; TRPC7; TRPV2","Sodium channel blocker",16231,"sodium channel blocker","AOC1, ASIC1, ASIC2, ASIC3, PKD2, PKD2L1, PLAU, SCNN1A, SCNN1B, SCNN1D, SCNN1G, SLC9A1, TRPC7, TRPV2","cardiology","hypertension, congestive heart failure","Launched",TRUE
"60","mephentermine","HA1E","trt_cp","down",-0.318869830378573,9.60452633866187e-05,0.000306092657711196,-0.9059567759249,-38.7773315484159,2241,0.576751664348806,100,31,"ADRA1A; ADRA1B; ADRA1D; ADRA2B; ADRA2C; ADRB1; ADRB2; ADRB3","Adrenergic receptor agonist",3677,"adrenergic receptor agonist","ADRA1A, ADRA1B, ADRA1D, ADRA2A, ADRA2B, ADRA2C, ADRB1, ADRB2, ADRB3","cardiology","hypotension","Launched",TRUE
